[
  {
    "id": "robe-t2-profile",
    "manufacturer": "Robe",
    "model": "T2 Profile",
    "category": "Moving-head hybrid",
    "maxPowerW": 1150,
    "ratedCurrentA": null,
    "ratedCurrentVoltageV": null,
    "maxVA": null,
    "supportedVoltage": "100–240 V AC, 50/60 Hz",
    "powerFactor": null,
    "inrushCurrentA": null,
    "lampCount": null,
    "lampWattage": null,
    "internalBasePowerW": null,
    "removableLamps": false,
    "partialLoadVerified": false,
    "sourceUrl": "https://www.robe.cz/t2-profile",
    "verificationDate": "2026-08-16",
    "status": "verified",
    "estimationNote": null
  },
  {
    "id": "robe-t1-profile",
    "manufacturer": "Robe",
    "model": "T1 Profile",
    "category": "Moving-head hybrid",
    "maxPowerW": 750,
    "ratedCurrentA": null,
    "ratedCurrentVoltageV": null,
    "maxVA": null,
    "supportedVoltage": "100–240 V AC, 50/60 Hz",
    "powerFactor": null,
    "inrushCurrentA": null,
    "lampCount": null,
    "lampWattage": null,
    "internalBasePowerW": null,
    "removableLamps": false,
    "partialLoadVerified": false,
    "sourceUrl": "https://www.robe.cz/t1-profile",
    "verificationDate": "2026-08-16",
    "status": "verified",
    "estimationNote": null
  },
  {
    "id": "robe-t10-profile",
    "manufacturer": "Robe",
    "model": "T10 Profile",
    "category": "Profile",
    "maxPowerW": 275,
    "ratedCurrentA": null,
    "ratedCurrentVoltageV": null,
    "maxVA": null,
    "supportedVoltage": "100–240 V AC, 50/60 Hz",
    "powerFactor": null,
    "inrushCurrentA": null,
    "lampCount": null,
    "lampWattage": null,
    "internalBasePowerW": null,
    "removableLamps": false,
    "partialLoadVerified": false,
    "sourceUrl": "https://www.robe.cz/t10-profile",
    "verificationDate": "2026-08-16",
    "status": "verified",
    "estimationNote": null
  },
  {
    "id": "martin-mac-aura-xip",
    "manufacturer": "Martin",
    "model": "MAC Aura XIP",
    "category": "Moving-head wash",
    "maxPowerW": 340,
    "ratedCurrentA": null,
    "ratedCurrentVoltageV": null,
    "maxVA": null,
    "supportedVoltage": "100–240 V AC, 50/60 Hz",
    "powerFactor": null,
    "inrushCurrentA": null,
    "lampCount": null,
    "lampWattage": null,
    "internalBasePowerW": null,
    "removableLamps": false,
    "partialLoadVerified": false,
    "sourceUrl": "https://www.martin.com/en/products/mac-aura-xip",
    "verificationDate": "2026-08-16",
    "status": "verified",
    "estimationNote": null
  },
  {
    "id": "martin-mac-aura-xb",
    "manufacturer": "Martin",
    "model": "MAC Aura XB",
    "category": "Moving-head wash",
    "maxPowerW": 400,
    "ratedCurrentA": null,
    "ratedCurrentVoltageV": null,
    "maxVA": null,
    "supportedVoltage": "100–240 V AC, 50/60 Hz",
    "powerFactor": null,
    "inrushCurrentA": null,
    "lampCount": null,
    "lampWattage": null,
    "internalBasePowerW": null,
    "removableLamps": false,
    "partialLoadVerified": false,
    "sourceUrl": "https://www.martin.com/en/products/mac-aura-xb",
    "verificationDate": "2026-08-16",
    "status": "verified",
    "estimationNote": null
  },
  {
    "id": "martin-mac-viper-xip",
    "manufacturer": "Martin",
    "model": "MAC Viper XIP",
    "category": "Moving-head spot",
    "maxPowerW": 1040,
    "ratedCurrentA": null,
    "ratedCurrentVoltageV": null,
    "maxVA": null,
    "supportedVoltage": "100–240 V AC, 50/60 Hz",
    "powerFactor": null,
    "inrushCurrentA": null,
    "lampCount": null,
    "lampWattage": null,
    "internalBasePowerW": null,
    "removableLamps": false,
    "partialLoadVerified": false,
    "sourceUrl": "https://www.martin.com/en/products/mac-viper-xip",
    "verificationDate": "2026-08-16",
    "status": "verified",
    "estimationNote": null
  },
  {
    "id": "showtec-sunstrip-active-mkii",
    "manufacturer": "Showtec",
    "model": "Sunstrip Active DMX Mk2",
    "category": "Sunstrip",
    "maxPowerW": 550,
    "ratedCurrentA": null,
    "ratedCurrentVoltageV": null,
    "maxVA": null,
    "supportedVoltage": "240 V AC, 50/60 Hz",
    "powerFactor": null,
    "inrushCurrentA": null,
    "lampCount": 10,
    "lampWattage": 50,
    "internalBasePowerW": 50,
    "removableLamps": true,
    "partialLoadVerified": false,
    "sourceUrl": "https://www.showtec.co.uk/onlineshop/index.php?route=product/product&product_id=455",
    "verificationDate": "2026-08-16",
    "status": "verified",
    "estimationNote": "Partial-load current is estimated from the documented 10 × 50 W lamps and 550 W total consumption."
  },
  {
    "id": "showtec-pixel-bar-16-q6",
    "manufacturer": "Showtec",
    "model": "Pixel Bar 16 Q6",
    "category": "Pixel bar",
    "maxPowerW": 170,
    "ratedCurrentA": null,
    "ratedCurrentVoltageV": null,
    "maxVA": null,
    "supportedVoltage": "100–240 V AC, 50/60 Hz",
    "powerFactor": null,
    "inrushCurrentA": null,
    "lampCount": null,
    "lampWattage": null,
    "internalBasePowerW": null,
    "removableLamps": false,
    "partialLoadVerified": false,
    "sourceUrl": "https://www.showtec.co.uk/onlineshop/index.php?route=product/product&product_id=1118",
    "verificationDate": "2026-08-16",
    "status": "verified",
    "estimationNote": null
  },
  {
    "id": "glp-jdc1",
    "manufacturer": "GLP",
    "model": "JDC1",
    "category": "Strobe",
    "maxPowerW": 1200,
    "ratedCurrentA": null,
    "ratedCurrentVoltageV": null,
    "maxVA": null,
    "supportedVoltage": "100–240 V AC, 50/60 Hz",
    "powerFactor": null,
    "inrushCurrentA": null,
    "lampCount": null,
    "lampWattage": null,
    "internalBasePowerW": null,
    "removableLamps": false,
    "partialLoadVerified": false,
    "sourceUrl": "https://glp.de/en/products/entertainment-lighting/strobes/jdc1-en",
    "verificationDate": "2026-08-16",
    "status": "verified",
    "estimationNote": null
  },
  {
    "id": "glp-jdc-line-500",
    "manufacturer": "GLP",
    "model": "JDC Line 500",
    "category": "LED bar",
    "maxPowerW": 800,
    "ratedCurrentA": null,
    "ratedCurrentVoltageV": null,
    "maxVA": null,
    "supportedVoltage": "100–240 V AC, 50/60 Hz",
    "powerFactor": null,
    "inrushCurrentA": null,
    "lampCount": null,
    "lampWattage": null,
    "internalBasePowerW": null,
    "removableLamps": false,
    "partialLoadVerified": false,
    "sourceUrl": "https://glp.de/en/products/entertainment-lighting/strobes/jdc-line-500-en",
    "verificationDate": "2026-08-16",
    "status": "verified",
    "estimationNote": null
  },
  {
    "id": "adj-mega-hex-par",
    "manufacturer": "ADJ",
    "model": "Mega Hex Par",
    "category": "LED PAR",
    "maxPowerW": 30,
    "ratedCurrentA": null,
    "ratedCurrentVoltageV": null,
    "maxVA": null,
    "supportedVoltage": "100–240 V AC, 50/60 Hz",
    "powerFactor": null,
    "inrushCurrentA": null,
    "lampCount": null,
    "lampWattage": null,
    "internalBasePowerW": null,
    "removableLamps": false,
    "partialLoadVerified": false,
    "sourceUrl": "https://www.adj.com/products/mega-hex-par",
    "verificationDate": "2026-08-16",
    "status": "verified",
    "estimationNote": null
  },
  {
    "id": "adj-mega-par-z-wash",
    "manufacturer": "ADJ",
    "model": "Mega Par Z Wash",
    "category": "LED PAR",
    "maxPowerW": 200,
    "ratedCurrentA": null,
    "ratedCurrentVoltageV": null,
    "maxVA": null,
    "supportedVoltage": "100–240 V AC, 50/60 Hz",
    "powerFactor": null,
    "inrushCurrentA": null,
    "lampCount": null,
    "lampWattage": null,
    "internalBasePowerW": null,
    "removableLamps": false,
    "partialLoadVerified": false,
    "sourceUrl": "https://www.adj.com/products/mega-par-z-wash",
    "verificationDate": "2026-08-16",
    "status": "verified",
    "estimationNote": null
  },
  {
    "id": "etc-source-four-par-575",
    "manufacturer": "ETC",
    "model": "Source Four PAR (575 W lamp)",
    "category": "Conventional PAR",
    "maxPowerW": 575,
    "ratedCurrentA": null,
    "ratedCurrentVoltageV": null,
    "maxVA": null,
    "supportedVoltage": "Depends on installed HPL lamp",
    "powerFactor": 1,
    "inrushCurrentA": null,
    "lampCount": 1,
    "lampWattage": 575,
    "internalBasePowerW": 0,
    "removableLamps": false,
    "partialLoadVerified": false,
    "sourceUrl": "https://www.etcconnect.com/Products/Legacy/Lighting-Fixtures/Source-Four-PAR/Features.aspx",
    "verificationDate": "2026-08-16",
    "status": "verified",
    "estimationNote": "Choose a custom load if the installed lamp is not 575 W."
  },
  {
    "id": "etc-source-four-mini-led",
    "manufacturer": "ETC",
    "model": "Source Four Mini LED",
    "category": "Profile",
    "maxPowerW": 20,
    "ratedCurrentA": null,
    "ratedCurrentVoltageV": null,
    "maxVA": null,
    "supportedVoltage": "Refer to installed power supply",
    "powerFactor": null,
    "inrushCurrentA": null,
    "lampCount": null,
    "lampWattage": null,
    "internalBasePowerW": null,
    "removableLamps": false,
    "partialLoadVerified": false,
    "sourceUrl": "https://www.etcconnect.com/Products/Architectural-Fixtures/Source-Four-Mini/Features.aspx",
    "verificationDate": "2026-08-16",
    "status": "verified",
    "estimationNote": "Power-supply losses are not included in the published 20 W fixture value."
  },
  {
    "id": "chauvet-dj-hurricane-haze-4d",
    "manufacturer": "Chauvet DJ",
    "model": "Hurricane Haze 4D",
    "category": "Hazer",
    "maxPowerW": 1120,
    "ratedCurrentA": 8.1,
    "ratedCurrentVoltageV": 120,
    "maxVA": null,
    "supportedVoltage": "120 V 60 Hz; separate 230 V 50 Hz version documented",
    "powerFactor": null,
    "inrushCurrentA": null,
    "lampCount": null,
    "lampWattage": null,
    "internalBasePowerW": null,
    "removableLamps": false,
    "partialLoadVerified": false,
    "sourceUrl": "https://www.chauvetdj.com/products/hurricane-haze-4d/",
    "verificationDate": "2026-08-16",
    "status": "verified",